[
  {"offer_id":"OFF-TM-FRZ-001","product_id":"P-FRZ-001","supplier":"TheMart","supplier_sku":"TM-FRZ-001","product_name":"Shrimp Frozen 1kg","category":"frozen","tier":"standard","pack_size":1,"pack_unit":"kg","price":9.1,"price_per_base_unit":9.1,"currency":"EUR","vat_rate":0.13,"captured_at":"2099-01-01T00:00:00+00:00","valid_until":"2099-01-31T00:00:00+00:00","in_stock":true},
  {"offer_id":"OFF-AL-FRZ-001","product_id":"P-FRZ-001","supplier":"Alios","supplier_sku":"AL-FRZ-001","product_name":"Shrimp Frozen 1kg","category":"frozen","tier":"standard","pack_size":1,"pack_unit":"kg","price":9.8,"price_per_base_unit":9.8,"currency":"EUR","vat_rate":0.13,"captured_at":"2099-01-01T00:00:00+00:00","valid_until":"2099-01-31T00:00:00+00:00","in_stock":true},

  {"offer_id":"OFF-TM-FRZ-002","product_id":"P-FRZ-002","supplier":"TheMart","supplier_sku":"TM-FRZ-002","product_name":"Salmon Frozen 1kg","category":"frozen","tier":"standard","pack_size":1,"pack_unit":"kg","price":11.2,"price_per_base_unit":11.2,"currency":"EUR","vat_rate":0.13,"captured_at":"2099-01-01T00:00:00+00:00","valid_until":"2099-01-31T00:00:00+00:00","in_stock":true},
  {"offer_id":"OFF-AL-FRZ-002","product_id":"P-FRZ-002","supplier":"Alios","supplier_sku":"AL-FRZ-002","product_name":"Salmon Frozen 1kg","category":"frozen","tier":"standard","pack_size":1,"pack_unit":"kg","price":11.4,"price_per_base_unit":11.4,"currency":"EUR","vat_rate":0.13,"captured_at":"2099-01-01T00:00:00+00:00","valid_until":"2099-01-31T00:00:00+00:00","in_stock":true},

  {"offer_id":"OFF-TM-FRZ-003","product_id":"P-FRZ-003","supplier":"TheMart","supplier_sku":"TM-FRZ-003","product_name":"Scallops Frozen 1kg","category":"frozen","tier":"standard","pack_size":1,"pack_unit":"kg","price":12.5,"price_per_base_unit":12.5,"currency":"EUR","vat_rate":0.13,"captured_at":"2099-01-01T00:00:00+00:00","valid_until":"2099-01-31T00:00:00+00:00","in_stock":true},
  {"offer_id":"OFF-AL-FRZ-003","product_id":"P-FRZ-003","supplier":"Alios","supplier_sku":"AL-FRZ-003","product_name":"Scallops Frozen 1kg","category":"frozen","tier":"standard","pack_size":1,"pack_unit":"kg","price":12.1,"price_per_base_unit":12.1,"currency":"EUR","vat_rate":0.13,"captured_at":"2099-01-01T00:00:00+00:00","valid_until":"2099-01-31T00:00:00+00:00","in_stock":true},

  {"offer_id":"OFF-TM-SEA-001","product_id":"P-SEA-001","supplier":"TheMart","supplier_sku":"TM-SEA-001","product_name":"Tuna Saku","category":"seafood","tier":"standard","pack_size":1,"pack_unit":"kg","price":18.8,"price_per_base_unit":18.8,"currency":"EUR","vat_rate":0.13,"captured_at":"2099-01-01T00:00:00+00:00","valid_until":"2099-01-31T00:00:00+00:00","in_stock":true},
  {"offer_id":"OFF-AL-SEA-001","product_id":"P-SEA-001","supplier":"Alios","supplier_sku":"AL-SEA-001","product_name":"Tuna Saku","category":"seafood","tier":"standard","pack_size":1,"pack_unit":"kg","price":19.7,"price_per_base_unit":19.7,"currency":"EUR","vat_rate":0.13,"captured_at":"2099-01-01T00:00:00+00:00","valid_until":"2099-01-31T00:00:00+00:00","in_stock":true},

  {"offer_id":"OFF-TM-SEA-002","product_id":"P-SEA-002","supplier":"TheMart","supplier_sku":"TM-SEA-002","product_name":"Octopus","category":"seafood","tier":"standard","pack_size":1,"pack_unit":"kg","price":15.9,"price_per_base_unit":15.9,"currency":"EUR","vat_rate":0.13,"captured_at":"2099-01-01T00:00:00+00:00","valid_until":"2099-01-31T00:00:00+00:00","in_stock":true},
  {"offer_id":"OFF-AL-SEA-002","product_id":"P-SEA-002","supplier":"Alios","supplier_sku":"AL-SEA-002","product_name":"Octopus","category":"seafood","tier":"standard","pack_size":1,"pack_unit":"kg","price":15.6,"price_per_base_unit":15.6,"currency":"EUR","vat_rate":0.13,"captured_at":"2099-01-01T00:00:00+00:00","valid_until":"2099-01-31T00:00:00+00:00","in_stock":true},

  {"offer_id":"OFF-TM-PRD-001","product_id":"P-PRD-001","supplier":"TheMart","supplier_sku":"TM-PRD-001","product_name":"Tomato","category":"produce","tier":"standard","pack_size":1,"pack_unit":"kg","price":2.5,"price_per_base_unit":2.5,"currency":"EUR","vat_rate":0.13,"captured_at":"2099-01-01T00:00:00+00:00","valid_until":"2099-01-31T00:00:00+00:00","in_stock":true},
  {"offer_id":"OFF-AL-PRD-001","product_id":"P-PRD-001","supplier":"Alios","supplier_sku":"AL-PRD-001","product_name":"Tomato","category":"produce","tier":"standard","pack_size":1,"pack_unit":"kg","price":2.3,"price_per_base_unit":2.3,"currency":"EUR","vat_rate":0.13,"captured_at":"2099-01-01T00:00:00+00:00","valid_until":"2099-01-31T00:00:00+00:00","in_stock":true},

  {"offer_id":"OFF-TM-PRD-002","product_id":"P-PRD-002","supplier":"TheMart","supplier_sku":"TM-PRD-002","product_name":"Lemon","category":"produce","tier":"standard","pack_size":1,"pack_unit":"kg","price":2.1,"price_per_base_unit":2.1,"currency":"EUR","vat_rate":0.13,"captured_at":"2099-01-01T00:00:00+00:00","valid_until":"2099-01-31T00:00:00+00:00","in_stock":true},
  {"offer_id":"OFF-AL-PRD-002","product_id":"P-PRD-002","supplier":"Alios","supplier_sku":"AL-PRD-002","product_name":"Lemon","category":"produce","tier":"standard","pack_size":1,"pack_unit":"kg","price":1.95,"price_per_base_unit":1.95,"currency":"EUR","vat_rate":0.13,"captured_at":"2099-01-01T00:00:00+00:00","valid_until":"2099-01-31T00:00:00+00:00","in_stock":true},

  {"offer_id":"OFF-TM-VEG-001","product_id":"P-VEG-001","supplier":"TheMart","supplier_sku":"TM-VEG-001","product_name":"Potato","category":"vegetables","tier":"standard","pack_size":1,"pack_unit":"kg","price":1.25,"price_per_base_unit":1.25,"currency":"EUR","vat_rate":0.13,"captured_at":"2099-01-01T00:00:00+00:00","valid_until":"2099-01-31T00:00:00+00:00","in_stock":true},
  {"offer_id":"OFF-AL-VEG-001","product_id":"P-VEG-001","supplier":"Alios","supplier_sku":"AL-VEG-001","product_name":"Potato","category":"vegetables","tier":"standard","pack_size":1,"pack_unit":"kg","price":1.15,"price_per_base_unit":1.15,"currency":"EUR","vat_rate":0.13,"captured_at":"2099-01-01T00:00:00+00:00","valid_until":"2099-01-31T00:00:00+00:00","in_stock":true},

  {"offer_id":"OFF-TM-VEG-002","product_id":"P-VEG-002","supplier":"TheMart","supplier_sku":"TM-VEG-002","product_name":"Onion","category":"vegetables","tier":"standard","pack_size":1,"pack_unit":"kg","price":1.4,"price_per_base_unit":1.4,"currency":"EUR","vat_rate":0.13,"captured_at":"2099-01-01T00:00:00+00:00","valid_until":"2099-01-31T00:00:00+00:00","in_stock":true},
  {"offer_id":"OFF-AL-VEG-002","product_id":"P-VEG-002","supplier":"Alios","supplier_sku":"AL-VEG-002","product_name":"Onion","category":"vegetables","tier":"standard","pack_size":1,"pack_unit":"kg","price":1.32,"price_per_base_unit":1.32,"currency":"EUR","vat_rate":0.13,"captured_at":"2099-01-01T00:00:00+00:00","valid_until":"2099-01-31T00:00:00+00:00","in_stock":true},

  {"offer_id":"OFF-TM-DRY-001","product_id":"P-DRY-001","supplier":"TheMart","supplier_sku":"TM-DRY-001","product_name":"Soy Sauce","category":"dry","tier":"standard","pack_size":1,"pack_unit":"lt","price":3.2,"price_per_base_unit":3.2,"currency":"EUR","vat_rate":0.24,"captured_at":"2099-01-01T00:00:00+00:00","valid_until":"2099-01-31T00:00:00+00:00","in_stock":true},
  {"offer_id":"OFF-AL-DRY-001","product_id":"P-DRY-001","supplier":"Alios","supplier_sku":"AL-DRY-001","product_name":"Soy Sauce","category":"dry","tier":"standard","pack_size":1,"pack_unit":"lt","price":2.9,"price_per_base_unit":2.9,"currency":"EUR","vat_rate":0.24,"captured_at":"2099-01-01T00:00:00+00:00","valid_until":"2099-01-31T00:00:00+00:00","in_stock":true},

  {"offer_id":"OFF-TM-PRD-003","product_id":"P-PRD-003","supplier":"TheMart","supplier_sku":"TM-PRD-003","product_name":"Apple","category":"produce","tier":"standard","pack_size":1,"pack_unit":"kg","price":2.8,"price_per_base_unit":2.8,"currency":"EUR","vat_rate":0.13,"captured_at":"2099-01-01T00:00:00+00:00","valid_until":"2099-01-31T00:00:00+00:00","in_stock":true},
  {"offer_id":"OFF-AL-PRD-003","product_id":"P-PRD-003","supplier":"Alios","supplier_sku":"AL-PRD-003","product_name":"Apple","category":"produce","tier":"standard","pack_size":1,"pack_unit":"kg","price":2.55,"price_per_base_unit":2.55,"currency":"EUR","vat_rate":0.13,"captured_at":"2099-01-01T00:00:00+00:00","valid_until":"2099-01-31T00:00:00+00:00","in_stock":true},

  {"offer_id":"OFF-TM-DRY-002","product_id":"P-DRY-002","supplier":"TheMart","supplier_sku":"TM-DRY-002","product_name":"Rice Vinegar","category":"condiments","tier":"standard","pack_size":1,"pack_unit":"lt","price":4.2,"price_per_base_unit":4.2,"currency":"EUR","vat_rate":0.24,"captured_at":"2099-01-01T00:00:00+00:00","valid_until":"2099-01-31T00:00:00+00:00","in_stock":true},
  {"offer_id":"OFF-AL-DRY-002","product_id":"P-DRY-002","supplier":"Alios","supplier_sku":"AL-DRY-002","product_name":"Rice Vinegar","category":"condiments","tier":"standard","pack_size":1,"pack_unit":"lt","price":4.35,"price_per_base_unit":4.35,"currency":"EUR","vat_rate":0.24,"captured_at":"2099-01-01T00:00:00+00:00","valid_until":"2099-01-31T00:00:00+00:00","in_stock":true}
]
